{
  "$schema": "https://technehub-labs.github.io/dea-metaframework/matrix-data.schema.json",
  "framework": "ECF",
  "version": "2.3.0",
  "source": "dea-metaframework/pages/assets/matrix-data.json (extracted from site.js constants)",
  "axes": {
    "domains": "rows (what the enterprise does)",
    "stages": "columns (how work evolves)"
  },
  "domains": [
    {
      "id": 1,
      "key": "governance",
      "name": "Governance & Existence",
      "shortName": "Governance",
      "color": "var(--l1)"
    },
    {
      "id": 2,
      "key": "strategy",
      "name": "Strategy & Direction",
      "shortName": "Strategy",
      "color": "var(--l2)"
    },
    {
      "id": 3,
      "key": "agency",
      "name": "Agency & Organization",
      "shortName": "Agency",
      "color": "var(--l3)"
    },
    {
      "id": 4,
      "key": "party",
      "name": "Party & Relationship",
      "shortName": "Party",
      "color": "var(--l4)"
    },
    {
      "id": 5,
      "key": "product",
      "name": "Product & Value",
      "shortName": "Product",
      "color": "var(--l5)"
    },
    {
      "id": 6,
      "key": "operations",
      "name": "Operations & Enablement",
      "shortName": "Operations",
      "color": "var(--l6)"
    },
    {
      "id": 7,
      "key": "finance",
      "name": "Finance & Accounting",
      "shortName": "Finance",
      "color": "var(--l7)"
    }
  ],
  "stages": [
    {
      "id": 1,
      "key": "conceive",
      "name": "Conceive",
      "fullName": "Conceive"
    },
    {
      "id": 2,
      "key": "design",
      "name": "Design",
      "fullName": "Design"
    },
    {
      "id": 3,
      "key": "build",
      "name": "Build",
      "fullName": "Build / Acquire"
    },
    {
      "id": 4,
      "key": "activate",
      "name": "Activate",
      "fullName": "Deploy / Activate"
    },
    {
      "id": 5,
      "key": "operate",
      "name": "Operate",
      "fullName": "Operate / Deliver"
    },
    {
      "id": 6,
      "key": "improve",
      "name": "Improve",
      "fullName": "Measure / Learn"
    },
    {
      "id": 7,
      "key": "retire",
      "name": "Retire",
      "fullName": "Retire / Renew"
    }
  ],
  "scenarios": {
    "foundation": {
      "name": "Foundation",
      "description": "Generic business object behavior — the canonical ECF cells.",
      "cells": {
        "governance.conceive": {
          "text": "Policy intent — mandate, charter, guiding principles.",
          "glyph": "●",
          "actors": [
            "governance-team"
          ],
          "metamodelEntities": [
            "Strategic Objective"
          ]
        },
        "governance.design": {
          "text": "Controls design — define the guardrails.",
          "glyph": "●",
          "actors": [
            "compliance-architect"
          ],
          "metamodelEntities": [
            "Standard"
          ]
        },
        "governance.build": {
          "text": "Compliance build — implement the controls.",
          "glyph": "●",
          "actors": [
            "platform-engineering"
          ],
          "metamodelEntities": [
            "Standard"
          ]
        },
        "governance.activate": {
          "text": "Enforce — turn controls on, audit gating.",
          "glyph": "●",
          "actors": [
            "audit",
            "platform-engineering"
          ],
          "metamodelEntities": [
            "Platform Service"
          ]
        },
        "governance.operate": {
          "text": "Assurance — continuous monitoring.",
          "glyph": "●",
          "actors": [
            "audit",
            "sre"
          ],
          "metamodelEntities": [
            "Performance Metric"
          ]
        },
        "governance.improve": {
          "text": "Risk review — periodic re-assessment.",
          "glyph": "●",
          "actors": [
            "risk-team"
          ],
          "metamodelEntities": [
            "Performance Metric"
          ]
        },
        "governance.retire": {
          "text": "Policy retire — sunset obsolete mandates.",
          "glyph": "·",
          "actors": [
            "governance-team"
          ],
          "metamodelEntities": [
            "Strategic Objective"
          ]
        },
        "strategy.conceive": {
          "text": "Purpose & ambition — mission, vision, aspiration.",
          "glyph": "●",
          "actors": [
            "strategy-lead",
            "executive"
          ],
          "metamodelEntities": [
            "Strategic Objective"
          ]
        },
        "strategy.design": {
          "text": "Strategic choices — positioning, scope, advantage logic.",
          "glyph": "●",
          "actors": [
            "strategy-lead"
          ],
          "metamodelEntities": [
            "Strategic Objective"
          ]
        },
        "strategy.build": {
          "text": "Initiative portfolio — roadmap, resource allocation.",
          "glyph": "★",
          "actors": [
            "strategy-lead",
            "pmo"
          ],
          "metamodelEntities": [
            "Investment Initiative"
          ]
        },
        "strategy.activate": {
          "text": "Launch direction — go-to-market alignment.",
          "glyph": "●",
          "actors": [
            "strategy-lead",
            "product"
          ],
          "metamodelEntities": [
            "Strategic Objective"
          ]
        },
        "strategy.operate": {
          "text": "Course correction — track vs plan, adapt.",
          "glyph": "●",
          "actors": [
            "strategy-lead"
          ],
          "metamodelEntities": [
            "Performance Metric"
          ]
        },
        "strategy.improve": {
          "text": "Strategic review — performance vs ambition.",
          "glyph": "●",
          "actors": [
            "strategy-lead",
            "executive"
          ],
          "metamodelEntities": [
            "Performance Metric"
          ]
        },
        "strategy.retire": {
          "text": "Strategic renewal — pivot, divest, transform.",
          "glyph": "●",
          "actors": [
            "executive",
            "strategy-lead"
          ],
          "metamodelEntities": [
            "Strategic Objective"
          ]
        },
        "agency.conceive": {
          "text": "Workforce plan — headcount and skills forecast.",
          "glyph": "●",
          "actors": [
            "workforce-planner"
          ],
          "metamodelEntities": [
            "Organizational Unit"
          ]
        },
        "agency.design": {
          "text": "Org design — team topology, RACI.",
          "glyph": "●",
          "actors": [
            "org-design"
          ],
          "metamodelEntities": [
            "Organizational Unit"
          ]
        },
        "agency.build": {
          "text": "Hire / train — bring people on.",
          "glyph": "●",
          "actors": [
            "recruiting",
            "l&d"
          ],
          "metamodelEntities": [
            "Organizational Unit"
          ]
        },
        "agency.activate": {
          "text": "Mobilize — assign to teams, onboarding.",
          "glyph": "●",
          "actors": [
            "line-manager"
          ],
          "metamodelEntities": [
            "Organizational Unit"
          ]
        },
        "agency.operate": {
          "text": "Perform & develop — regular work.",
          "glyph": "●",
          "actors": [
            "line-manager"
          ],
          "metamodelEntities": [
            "Business Process"
          ]
        },
        "agency.improve": {
          "text": "Engagement — pulse surveys, eNPS.",
          "glyph": "●",
          "actors": [
            "agent-ops"
          ],
          "metamodelEntities": [
            "Performance Metric"
          ]
        },
        "agency.retire": {
          "text": "Offboard / reassign — exit or transfer.",
          "glyph": "●",
          "actors": [
            "agent-ops"
          ],
          "metamodelEntities": [
            "Organizational Unit"
          ]
        },
        "party.conceive": {
          "text": "Party identification — discovery, segmentation, qualification.",
          "glyph": "●",
          "actors": [
            "marketing",
            "sales"
          ],
          "metamodelEntities": [
            "Value Stream"
          ]
        },
        "party.design": {
          "text": "Journey mapping — personas, friction points, channel design.",
          "glyph": "●",
          "actors": [
            "product-design"
          ],
          "metamodelEntities": [
            "Journey Touchpoint"
          ]
        },
        "party.build": {
          "text": "Onboarding — contracting, trust, integration.",
          "glyph": "●",
          "actors": [
            "sales",
            "legal"
          ],
          "metamodelEntities": [
            "Business Process"
          ]
        },
        "party.activate": {
          "text": "Activation — first value moment, relationship start.",
          "glyph": "★",
          "actors": [
            "sales",
            "growth"
          ],
          "metamodelEntities": [
            "Journey Touchpoint"
          ]
        },
        "party.operate": {
          "text": "Engagement & service — communication, support.",
          "glyph": "●",
          "actors": [
            "care-ops"
          ],
          "metamodelEntities": [
            "Business Process"
          ]
        },
        "party.improve": {
          "text": "Relationship development — NPS, retention, deepening.",
          "glyph": "●",
          "actors": [
            "analytics",
            "care-ops"
          ],
          "metamodelEntities": [
            "Performance Metric"
          ]
        },
        "party.retire": {